level,tag,value,instructions
2,hosting-service-needed,OPT,Indicate whether a hosting service is needed. This field should only be included if no distributor is currently providing data access.
2,delay-collection-dissemination,OPT,Enter the approximate delay between data collection and dissemination.
2,delay-collection-dissemination-explanation,OPT,If the delay between data collection and dissemination is longer than the latency of automated processing; explain under what authority data access is delayed. This field should only be included if the delay is longer than the latency of automated processing.
2,archive-location,OPT,Enter only one of the following fixed values: NCEI-MD; NCEI-CO; NCEI-NC; NCEI-MS; World Data Center (WDC) Facility; Other; To Be Determined; Unable to Archive; No Archiving Intended
2,archive-location-explanation-other,OPT,Specify the archive location; if World Data Center (WDC) Facility or Other was entered. This field should only be included if one of those values was entered. 
2,archive-location-explanation-none,OPT,Provide an explanation; if To Be Determined; Unable to Archive; or No Archiving Intended was entered.
2,delay-collection-archive,OPT,45 days
2,data-protection-plan,OPT,Discuss how the data will be protected from accidental or malicious modification or deletion prior to receipt by the archive. Include relevant information on data back-up; disaster recovery/contingency planning; and off-site data storage relevant to the data collection.
1,lineage
2,lineage-statement,OPT,Enter the lineage statement.
2,lineage-sources
3,lineage-source
4,citation-title,REQUIRED,REQUIRED. Enter the citation title of the lineage source.
4,originator-publisher-type,OPT,Indicate the type of originator/publisher related to the lineage source citation. The value here must be one of the following values: "InPort Person"; "InPort Organization"; or "Non-InPort Person/Organization".
4,originator-publisher,OPT,If the originator/publisher is a person who exists in InPort; enter their email address here (do not enter their name). If the originator/publisher is an organization that exists in InPort; enter the organization name; exactly as it appears in InPort; here. If the originator/publisher is a person or organization that does not exist in InPort; enter the person/organization name here.
4,publish-date,OPT,Enter the publication date of the lineage source citation in ISO 8601 extended format (YYYY-MM-DD).
4,extent-type,OPT,Enter Continuing; Range or Discrete
4,extent-start-date-time,OPT,Enter a start date/time of the lineage source's temporal extent in ISO 8601 extended format (YYYY-MM-DDThh:mm:ss); up to the appropriate granularity which is significant. For example; if the date/time is significant only up to the month; enter YYYY-MM. Date/times are interpreted as GMT.
4,extent-end-date-time,OPT,If the time frame is a Range; enter the end date/time of the lineage source's temporal extent in ISO 8601 extended format (YYYY-MM-DDThh:mm:ss); up to the appropriate granularity which is significant. For example; if the date/time is significant only up to the month; enter YYYY-MM. Date/times are interpreted as GMT. The end date/time must be later than the start date/time.
4,scale-denominator,OPT,Enter the scale denominator of the lineage source as an integer. The value must be greater than zero.
4,citation-url,OPT,Enter the citation URL. The URL must start with http:// or https://.
4,citation-url-name,OPT,Enter the name of the citation URL.
4,citation-url-description,OPT,Enter the description of the citation URL.
4,source-contribution,OPT,Enter a brief statement identifying the information contributed by the source to the data set.
2,lineage-process-steps
3,lineage-process-step
4,sequence-number,REQUIRED,REQUIRED. Enter the sequence number as an integer.
4,description,REQUIRED,REQUIRED. Enter a description for the process step.
4,process-date-time,OPT,Enter the process date/time of the step in ISO 8601 extended format (YYYY-MM-DDThh:mm:ss). Any valid granularity is acceptable; but the value will be stored up to seconds precision; in GMT.
4,process-contact-type,OPT,Indicate the type of process contact related to the lineage process step. The value here must be one of the following values: "InPort Person"; "InPort Organization"; or "Non-InPort Person/Organization".
4,process-contact,OPT,If the process contact is a person who exists in InPort; enter their email address here (do not enter their name). If the process contact is an organization that exists in InPort; enter the organization name; exactly as it appears in InPort; here. If the process contact is a person or organization that does not exist in InPort; enter the person/organization name here.
4,process-contact-phone,OPT,Only applicable for process contacts that do not exist in InPort. Enter the phone number of the process contact.
4,process-contact-email-address,OPT,Only applicable for process contacts that do not exist in InPort. Enter the email address of the process contact.
4,source-citation,OPT,Enter the source citation; if any. This must match the citation title of a lineage source exactly; or it will not be included.
1,acquisition-information
2,instrument-unavailable-reason,OPT,Applicable only if instrument information is unavailable. Enter a reason from the following list of possible values: Not Applicable; Unknown; Withheld.
2,instruments
3,instrument
4,identifier,REQUIRED,Either identifier OR docucomp-uuid are REQUIRED. The Instrument identifier must exist in InPort.
4,docucomp-uuid,REQUIRED,Either identifier OR docucomp-uuid are REQUIRED. The Docucomp UUID must exist in InPort.
2,platform-unavailable-reason,OPT,Applicable only if platform information is unavailable. Enter a reason from the following list of possible values: Not Applicable; Unknown; Withheld.
2,platforms
3,platform
4,identifier,REQUIRED,Either identifier OR docucomp-uuid are REQUIRED. The Platform identifier must exist in InPort.
4,docucomp-uuid,REQUIRED,Either identifier OR docucomp-uuid are REQUIRED. The Docucomp UUID must exist in InPort.
4,mounted-instruments
5,instrument
6,identifier,REQUIRED,Either identifier OR docucomp-uuid are REQUIRED. The Mounted Instrument identifier must be one of the Instruments declared for this record.
6,docucomp-uuid,REQUIRED,Either identifier OR docucomp-uuid are REQUIRED. The Docucomp UUID must correspond to one of the Instruments declared for this record.
1,faqs
2,faq
3,date,REQUIRED,REQUIRED. Enter the date/time of the FAQ in ISO 8601 extended format (YYYY-MM-DDThh:mm:ss); up        to the appropriate granularity which is significant. For example; if the date/time is        significant only up to the month; enter YYYY-MM. Dates will be interpreted as GMT.      
3,author-email,REQUIRED,REQUIRED. Enter the email address of the author. The person must be listed in        InPort with this email address.      
3,question,REQUIRED,REQUIRED. Enter the FAQ question.
3,answer,REQUIRED,REQUIRED. Enter the FAQ answer.
1,related-items
2,related-item
3,catalog-item-id,REQUIRED,REQUIRED. Enter the cat ID of the item to create a related item link to. The catalog item linked to must have a linking share level that allows creating a related item        link to it.      
3,relationship-type,REQUIRED,REQUIRED. Enter the relationship type from the following list of possible values: Cross Reference; Larger Work Citation; Part of a Seamless Database; Stereo Mate; Revision Of; Series.
3,notes,OPT,Enter notes on the relationship between this catalog item and the one linked to.      
1,catalog-details
2,is-do-not-publish,OPT,Enter Yes or No; in regards to whether or not this item and its children are      allowed to be published. Defaults to No.    
2,metadata-next-review-date,OPT,Enter the metadata next review date in ISO 8601 extended format      (YYYY-MM-DD).    
2,linking-share-level,OPT,Enter one of the following values: Across the InPort Catalog; Within this      Item's Library; Within this Item's Project. Defaults to Across the InPort Catalog.    
